{
  "id": "rimsky-korsakov",
  "full_name_ru": "Николай Римский-Корсаков",
  "full_name_en": "Nikolai Rimsky-Korsakov",
  "birth": 1844,
  "death": 1908,
  "country": "Россия",
  "era": "romanticism",
  "summary_ru": "Русский композитор «Могучей кучки», бывший морской офицер, профессор Петербургской консерватории (его учеником был Стравинский). Знаменит оркестровкой («Шехеразада», «Испанское каприччио», «Светлый праздник») и операми. Завершил «Бориса Годунова» Мусоргского и «Князя Игоря» Бородина после их смерти.",
  "photo": "rimsky-korsakov.jpg",
  "photo_credit": "Valentin Serov · 1898 · масло · PD",
  "photo_license": "PD",
  "source": "https://en.wikipedia.org/wiki/Nikolai_Rimsky-Korsakov"
}